{
  "mapping_frozen_before_semantic_measurement": true,
  "population_fingerprint": "a2334cebe8257ee0df548e5dade512777652a3fc9b721e7de46af0ac28844e9b",
  "records": [
    {
      "affected_revision": "2bb9a85ddedc7b8aa1bd866bd70e41364c8783f7",
      "affected_version": "0.0.3",
      "category": "runtime_function",
      "cve_id": "CVE-2021-29934",
      "depth_applicability": "applicable",
      "depth_nonapplicability_reason": null,
      "excluded_changes": "Tests, newly introduced remediation helpers, diagnostics and option/result propagation are not mapped solely because the fix changes them. See location-specific rationale and review notes.",
      "fix_evidence": [
        "https://github.com/uutils/coreutils/commit/39d62c6.patch"
      ],
      "fix_revision": "39d62c6c1f809022c903180471c10fde6ecd12d1",
      "mapping_completeness": "reviewed_primary_evidence",
      "mapping_frozen_before_semantic_measurement": true,
      "mapping_status": "verified",
      "review_notes": [
        "The Read implementation exposes uninitialized Vec storage to a safe Read implementation after set_len; RustSec identifies PartialReader and the patch replaces this allocation."
      ],
      "unresolved_reason": null,
      "vulnerable_functions": [
        {
          "affected_executables": [
            "od"
          ],
          "affected_revision": "2bb9a85ddedc7b8aa1bd866bd70e41364c8783f7",
          "affected_version": "0.0.3",
          "crate_or_package": "uu_od",
          "executable_scope_basis": "Advisory and utility-owned source; shared consumers are supported by the vulnerable source and corrective patch, not graph reachability measurements.",
          "fix_revision": "39d62c6c1f809022c903180471c10fde6ecd12d1",
          "function": "PartialReader<R>::read",
          "mapping_confidence": "high",
          "mapping_evidence": [
            "https://github.com/uutils/coreutils/blob/2bb9a85ddedc7b8aa1bd866bd70e41364c8783f7/src/uu/od/src/partialreader.rs",
            "https://github.com/uutils/coreutils/commit/39d62c6.patch",
            "https://raw.githubusercontent.com/CVEProject/cvelistV5/main/cves/2021/29xxx/CVE-2021-29934.json",
            "https://rustsec.org/advisories/RUSTSEC-2021-0043.html"
          ],
          "mapping_frozen_before_semantic_measurement": true,
          "mapping_reason": "The Read implementation exposes uninitialized Vec storage to a safe Read implementation after set_len; RustSec identifies PartialReader and the patch replaces this allocation.",
          "mapping_status": "verified",
          "source_file": "src/uu/od/src/partialreader.rs",
          "source_identity": "src/uu/od/src/partialreader.rs::PartialReader<R>::read",
          "source_sha256": "2551c091e8809e6660e741653808de8f0357c0d695cd7617b19db6a9c471b5bf",
          "utility_or_shared_component": "od"
        }
      ]
    },
    {
      "affected_revision": "3a07ffc5a9bd4c283e75afa548ba1f1957bad242",
      "affected_version": "0.2.2",
      "category": "runtime_function",
      "cve_id": "CVE-2026-35338",
      "depth_applicability": "applicable",
      "depth_nonapplicability_reason": null,
      "excluded_changes": "Tests, newly introduced remediation helpers, diagnostics and option/result propagation are not mapped solely because the fix changes them. See location-specific rationale and review notes.",
      "fix_evidence": [
        "https://api.github.com/repos/uutils/coreutils/pulls/10033",
        "https://github.com/uutils/coreutils/pull/10033.patch"
      ],
      "fix_revision": "413055b378fa6fe2299c5e5f538c8e6e841ab810",
      "mapping_completeness": "reviewed_primary_evidence",
      "mapping_frozen_before_semantic_measurement": true,
      "mapping_status": "verified",
      "review_notes": [
        "The preserve-root guard compares the pathname literally with slash, permitting alternate paths to the root. This is the defective guard, not the replacement root-identification helper."
      ],
      "unresolved_reason": null,
      "vulnerable_functions": [
        {
          "affected_executables": [
            "chmod"
          ],
          "affected_revision": "3a07ffc5a9bd4c283e75afa548ba1f1957bad242",
          "affected_version": "0.2.2",
          "crate_or_package": "uu_chmod",
          "executable_scope_basis": "Advisory and utility-owned source; shared consumers are supported by the vulnerable source and corrective patch, not graph reachability measurements.",
          "fix_revision": "413055b378fa6fe2299c5e5f538c8e6e841ab810",
          "function": "Chmoder::chmod",
          "mapping_confidence": "high",
          "mapping_evidence": [
            "https://api.github.com/repos/uutils/coreutils/pulls/10033",
            "https://github.com/uutils/coreutils/blob/3a07ffc5a9bd4c283e75afa548ba1f1957bad242/src/uu/chmod/src/chmod.rs",
            "https://github.com/uutils/coreutils/pull/10033",
            "https://github.com/uutils/coreutils/pull/10033.patch",
            "https://github.com/uutils/coreutils/releases/tag/0.6.0",
            "https://github.com/uutils/coreutils/security/advisories/GHSA-4c7q-4928-8445",
            "https://raw.githubusercontent.com/CVEProject/cvelistV5/main/cves/2026/35xxx/CVE-2026-35338.json"
          ],
          "mapping_frozen_before_semantic_measurement": true,
          "mapping_reason": "The preserve-root guard compares the pathname literally with slash, permitting alternate paths to the root. This is the defective guard, not the replacement root-identification helper.",
          "mapping_status": "verified",
          "source_file": "src/uu/chmod/src/chmod.rs",
          "source_identity": "src/uu/chmod/src/chmod.rs::Chmoder::chmod",
          "source_sha256": "74854b94a97bbf21e855ab4fd386ba9cd4a9c6ec14752dce51d84e347166bb17",
          "utility_or_shared_component": "chmod"
        }
      ]
    },
    {
      "affected_revision": "3a07ffc5a9bd4c283e75afa548ba1f1957bad242",
      "affected_version": "0.2.2",
      "category": "runtime_function",
      "cve_id": "CVE-2026-35339",
      "depth_applicability": "applicable",
      "depth_nonapplicability_reason": null,
      "excluded_changes": "Tests, newly introduced remediation helpers, diagnostics and option/result propagation are not mapped solely because the fix changes them. See location-specific rationale and review notes.",
      "fix_evidence": [
        "https://api.github.com/repos/uutils/coreutils/pulls/9793",
        "https://github.com/uutils/coreutils/pull/9793.patch"
      ],
      "fix_revision": "abd581f62e97d0b147306ac40eac13af71c6fbba",
      "mapping_completeness": "reviewed_primary_evidence",
      "mapping_frozen_before_semantic_measurement": true,
      "mapping_status": "verified",
      "review_notes": [
        "The recursive loop replaces its accumulated result with each child's result, so a later success masks an earlier failure."
      ],
      "unresolved_reason": null,
      "vulnerable_functions": [
        {
          "affected_executables": [
            "chmod"
          ],
          "affected_revision": "3a07ffc5a9bd4c283e75afa548ba1f1957bad242",
          "affected_version": "0.2.2",
          "crate_or_package": "uu_chmod",
          "executable_scope_basis": "Advisory and utility-owned source; shared consumers are supported by the vulnerable source and corrective patch, not graph reachability measurements.",
          "fix_revision": "abd581f62e97d0b147306ac40eac13af71c6fbba",
          "function": "Chmoder::chmod",
          "mapping_confidence": "high",
          "mapping_evidence": [
            "https://api.github.com/repos/uutils/coreutils/pulls/9793",
            "https://github.com/uutils/coreutils/blob/3a07ffc5a9bd4c283e75afa548ba1f1957bad242/src/uu/chmod/src/chmod.rs",
            "https://github.com/uutils/coreutils/pull/9793",
            "https://github.com/uutils/coreutils/pull/9793.patch",
            "https://github.com/uutils/coreutils/releases/tag/0.6.0",
            "https://github.com/uutils/coreutils/security/advisories/GHSA-4x34-chg5-mwjj",
            "https://raw.githubusercontent.com/CVEProject/cvelistV5/main/cves/2026/35xxx/CVE-2026-35339.json"
          ],
          "mapping_frozen_before_semantic_measurement": true,
          "mapping_reason": "The recursive loop replaces its accumulated result with each child's result, so a later success masks an earlier failure.",
          "mapping_status": "verified",
          "source_file": "src/uu/chmod/src/chmod.rs",
          "source_identity": "src/uu/chmod/src/chmod.rs::Chmoder::chmod",
          "source_sha256": "74854b94a97bbf21e855ab4fd386ba9cd4a9c6ec14752dce51d84e347166bb17",
          "utility_or_shared_component": "chmod"
        }
      ]
    },
    {
      "affected_revision": "3a07ffc5a9bd4c283e75afa548ba1f1957bad242",
      "affected_version": "0.2.2",
      "category": "shared_runtime_library",
      "cve_id": "CVE-2026-35340",
      "depth_applicability": "applicable",
      "depth_nonapplicability_reason": null,
      "excluded_changes": "Tests, newly introduced remediation helpers, diagnostics and option/result propagation are not mapped solely because the fix changes them. See location-specific rationale and review notes.",
      "fix_evidence": [
        "https://api.github.com/repos/uutils/coreutils/pulls/10035",
        "https://github.com/uutils/coreutils/pull/10035.patch"
      ],
      "fix_revision": "ebc08af9c34138f474b32ea0ef34bed3b086a3ed",
      "mapping_completeness": "reviewed_primary_evidence",
      "mapping_frozen_before_semantic_measurement": true,
      "mapping_status": "verified",
      "review_notes": [
        "The shared ownership traversal overwrites the accumulated status while visiting children; the patch combines results instead. Both chown and chgrp use this executor."
      ],
      "unresolved_reason": null,
      "vulnerable_functions": [
        {
          "affected_executables": [
            "chgrp",
            "chown"
          ],